{
  "schemaVersion": "cartofreako-standard-artifact-manifest-v1",
  "inventorySource": "Makefile:GENERATED_SVGS",
  "lifecycle": "standard",
  "artifactCount": 223,
  "artifacts": [
    {
      "id": "anthropocene-particulate-2025.authagraph.whole-map",
      "stem": "anthropocene-particulate-2025-authagraph-44-19.052559",
      "sourceSvg": "assets.generated/authagraph/svg/anthropocene-particulate-2025-authagraph-44-19.052559.svg",
      "lifecycle": "standard",
      "passId": "anthropocene-particulate-2025",
      "projectionId": "authagraph",
      "layoutId": "authagraph",
      "family": "authagraph",
      "sliceId": null
    },
    {
      "id": "anthropocene-particulate-2026.authagraph.whole-map",
      "stem": "anthropocene-particulate-2026-authagraph-44-19.052559",
      "sourceSvg": "assets.generated/authagraph/svg/anthropocene-particulate-2026-authagraph-44-19.052559.svg",
      "lifecycle": "standard",
      "passId": "anthropocene-particulate-2026",
      "projectionId": "authagraph",
      "layoutId": "authagraph",
      "family": "authagraph",
      "sliceId": null
    },
    {
      "id": "anthropocene-temperature-2025.authagraph.whole-map",
      "stem": "anthropocene-temperature-2025-authagraph-44-19.052559",
      "sourceSvg": "assets.generated/authagraph/svg/anthropocene-temperature-2025-authagraph-44-19.052559.svg",
      "lifecycle": "standard",
      "passId": "anthropocene-temperature-2025",
      "projectionId": "authagraph",
      "layoutId": "authagraph",
      "family": "authagraph",
      "sliceId": null
    },
    {
      "id": "anthropocene-temperature-2026.authagraph.whole-map",
      "stem": "anthropocene-temperature-2026-authagraph-44-19.052559",
      "sourceSvg": "assets.generated/authagraph/svg/anthropocene-temperature-2026-authagraph-44-19.052559.svg",
      "lifecycle": "standard",
      "passId": "anthropocene-temperature-2026",
      "projectionId": "authagraph",
      "layoutId": "authagraph",
      "family": "authagraph",
      "sliceId": null
    },
    {
      "id": "astro-all-sky.authagraph.whole-map",
      "stem": "astro-all-sky-authagraph-44-19.052559",
      "sourceSvg": "assets.generated/authagraph/svg/astro-all-sky-authagraph-44-19.052559.svg",
      "lifecycle": "standard",
      "passId": "astro-all-sky",
      "projectionId": "authagraph",
      "layoutId": "authagraph",
      "family": "authagraph",
      "sliceId": null
    },
    {
      "id": "astro-observer-ground-multiband.authagraph.whole-map",
      "stem": "astro-observer-ground-multiband-authagraph-44-19.052559",
      "sourceSvg": "assets.generated/authagraph/svg/astro-observer-ground-multiband-authagraph-44-19.052559.svg",
      "lifecycle": "standard",
      "passId": "astro-observer-ground-multiband",
      "projectionId": "authagraph",
      "layoutId": "authagraph",
      "family": "authagraph",
      "sliceId": null
    },
    {
      "id": "astro-observer-hubble.authagraph.whole-map",
      "stem": "astro-observer-hubble-authagraph-44-19.052559",
      "sourceSvg": "assets.generated/authagraph/svg/astro-observer-hubble-authagraph-44-19.052559.svg",
      "lifecycle": "standard",
      "passId": "astro-observer-hubble",
      "projectionId": "authagraph",
      "layoutId": "authagraph",
      "family": "authagraph",
      "sliceId": null
    },
    {
      "id": "bathymetry-hamonshu.authagraph.whole-map",
      "stem": "bathymetry-hamonshu-authagraph-44-19.052559",
      "sourceSvg": "assets.generated/authagraph/svg/bathymetry-hamonshu-authagraph-44-19.052559.svg",
      "lifecycle": "standard",
      "passId": "bathymetry-hamonshu",
      "projectionId": "authagraph",
      "layoutId": "authagraph",
      "family": "authagraph",
      "sliceId": null
    },
    {
      "id": "bathymetry-roulette.authagraph.whole-map",
      "stem": "bathymetry-roulette-authagraph-44-19.052559",
      "sourceSvg": "assets.generated/authagraph/svg/bathymetry-roulette-authagraph-44-19.052559.svg",
      "lifecycle": "standard",
      "passId": "bathymetry-roulette",
      "projectionId": "authagraph",
      "layoutId": "authagraph",
      "family": "authagraph",
      "sliceId": null
    },
    {
      "id": "earth.authagraph.whole-map",
      "stem": "earth-authagraph-44-19.052559",
      "sourceSvg": "assets.generated/authagraph/svg/earth-authagraph-44-19.052559.svg",
      "lifecycle": "standard",
      "passId": "earth",
      "projectionId": "authagraph",
      "layoutId": "authagraph",
      "family": "authagraph",
      "sliceId": null
    },
    {
      "id": "geometry.authagraph.whole-map",
      "stem": "geometry-authagraph-44-19.052559",
      "sourceSvg": "assets.generated/authagraph/svg/geometry-authagraph-44-19.052559.svg",
      "lifecycle": "standard",
      "passId": "geometry",
      "projectionId": "authagraph",
      "layoutId": "authagraph",
      "family": "authagraph",
      "sliceId": null
    },
    {
      "id": "graticules.authagraph.whole-map",
      "stem": "graticules-authagraph-44-19.052559",
      "sourceSvg": "assets.generated/authagraph/svg/graticules-authagraph-44-19.052559.svg",
      "lifecycle": "standard",
      "passId": "graticules",
      "projectionId": "authagraph",
      "layoutId": "authagraph",
      "family": "authagraph",
      "sliceId": null
    },
    {
      "id": "network-cdn.authagraph.whole-map",
      "stem": "network-cdn-authagraph-44-19.052559",
      "sourceSvg": "assets.generated/authagraph/svg/network-cdn-authagraph-44-19.052559.svg",
      "lifecycle": "standard",
      "passId": "network-cdn",
      "projectionId": "authagraph",
      "layoutId": "authagraph",
      "family": "authagraph",
      "sliceId": null
    },
    {
      "id": "network-fiber.authagraph.whole-map",
      "stem": "network-fiber-authagraph-44-19.052559",
      "sourceSvg": "assets.generated/authagraph/svg/network-fiber-authagraph-44-19.052559.svg",
      "lifecycle": "standard",
      "passId": "network-fiber",
      "projectionId": "authagraph",
      "layoutId": "authagraph",
      "family": "authagraph",
      "sliceId": null
    },
    {
      "id": "network-groundstations.authagraph.whole-map",
      "stem": "network-groundstations-authagraph-44-19.052559",
      "sourceSvg": "assets.generated/authagraph/svg/network-groundstations-authagraph-44-19.052559.svg",
      "lifecycle": "standard",
      "passId": "network-groundstations",
      "projectionId": "authagraph",
      "layoutId": "authagraph",
      "family": "authagraph",
      "sliceId": null
    },
    {
      "id": "network-swarm.authagraph.whole-map",
      "stem": "network-swarm-authagraph-44-19.052559",
      "sourceSvg": "assets.generated/authagraph/svg/network-swarm-authagraph-44-19.052559.svg",
      "lifecycle": "standard",
      "passId": "network-swarm",
      "projectionId": "authagraph",
      "layoutId": "authagraph",
      "family": "authagraph",
      "sliceId": null
    },
    {
      "id": "network-swarm-lt-1080p.authagraph.whole-map",
      "stem": "network-swarm-lt-1080p-authagraph-44-19.052559",
      "sourceSvg": "assets.generated/authagraph/svg/network-swarm-lt-1080p-authagraph-44-19.052559.svg",
      "lifecycle": "standard",
      "passId": "network-swarm-lt-1080p",
      "projectionId": "authagraph",
      "layoutId": "authagraph",
      "family": "authagraph",
      "sliceId": null
    },
    {
      "id": "orbital-technosphere-global.authagraph.whole-map",
      "stem": "orbital-technosphere-global-authagraph-44-19.052559",
      "sourceSvg": "assets.generated/authagraph/svg/orbital-technosphere-global-authagraph-44-19.052559.svg",
      "lifecycle": "standard",
      "passId": "orbital-technosphere-global",
      "projectionId": "authagraph",
      "layoutId": "authagraph",
      "family": "authagraph",
      "sliceId": null
    },
    {
      "id": "orbital-technosphere-observer.authagraph.whole-map",
      "stem": "orbital-technosphere-observer-authagraph-44-19.052559",
      "sourceSvg": "assets.generated/authagraph/svg/orbital-technosphere-observer-authagraph-44-19.052559.svg",
      "lifecycle": "standard",
      "passId": "orbital-technosphere-observer",
      "projectionId": "authagraph",
      "layoutId": "authagraph",
      "family": "authagraph",
      "sliceId": null
    },
    {
      "id": "resources-energy-nuclear-operating-capacity-2024.authagraph.whole-map",
      "stem": "resources-energy-nuclear-operating-capacity-2024-authagraph-44-19.052559",
      "sourceSvg": "assets.generated/authagraph/svg/resources-energy-nuclear-operating-capacity-2024-authagraph-44-19.052559.svg",
      "lifecycle": "standard",
      "passId": "resources-energy-nuclear-operating-capacity-2024",
      "projectionId": "authagraph",
      "layoutId": "authagraph",
      "family": "authagraph",
      "sliceId": null
    },
    {
      "id": "resources-energy-petrochemical-refinery-throughput-latest-2024.authagraph.whole-map",
      "stem": "resources-energy-petrochemical-refinery-throughput-latest-2024-authagraph-44-19.052559",
      "sourceSvg": "assets.generated/authagraph/svg/resources-energy-petrochemical-refinery-throughput-latest-2024-authagraph-44-19.052559.svg",
      "lifecycle": "standard",
      "passId": "resources-energy-petrochemical-refinery-throughput-latest-2024",
      "projectionId": "authagraph",
      "layoutId": "authagraph",
      "family": "authagraph",
      "sliceId": null
    },
    {
      "id": "resources-energy-solar-capacity-2025.authagraph.whole-map",
      "stem": "resources-energy-solar-capacity-2025-authagraph-44-19.052559",
      "sourceSvg": "assets.generated/authagraph/svg/resources-energy-solar-capacity-2025-authagraph-44-19.052559.svg",
      "lifecycle": "standard",
      "passId": "resources-energy-solar-capacity-2025",
      "projectionId": "authagraph",
      "layoutId": "authagraph",
      "family": "authagraph",
      "sliceId": null
    },
    {
      "id": "resources-energy-wind-capacity-2025.authagraph.whole-map",